[
  {
    "created": "2026-10-21T15:47:36Z",
    "decided_in_pr": 43,
    "decision": "rejected",
    "id": "rev_006204953912",
    "kind": "event",
    "reason": "needs review: no tech keywords",
    "ref": "evt_2ae1f434db2e"
  },
  {
    "created": "2026-10-21T15:47:36Z",
    "decided_in_pr": 43,
    "decision": "rejected",
    "id": "rev_1e8f3c4b5887",
    "kind": "event",
    "reason": "needs review: no tech keywords",
    "ref": "evt_91be51cd0f16"
  },
  {
    "created": "2026-10-21T15:47:36Z",
    "decided_in_pr": 43,
    "decision": "rejected",
    "id": "rev_556eb5ea8ecb",
    "kind": "event",
    "reason": "new event from a probationary source",
    "ref": "evt_461ed13d2018"
  },
  {
    "created": "2026-10-21T15:47:36Z",
    "decided_in_pr": 43,
    "decision": "rejected",
    "id": "rev_7414189bddf4",
    "kind": "event",
    "reason": "new event from a probationary source",
    "ref": "evt_14607d59c4e9"
  },
  {
    "created": "2026-10-21T15:47:36Z",
    "decided_in_pr": 43,
    "decision": "rejected",
    "id": "rev_829cc86352a5",
    "kind": "event",
    "reason": "new event from a probationary source",
    "ref": "evt_e9919b25de48"
  },
  {
    "created": "2026-10-21T15:47:36Z",
    "decided_in_pr": 43,
    "decision": "rejected",
    "id": "rev_876924d181bd",
    "kind": "event",
    "reason": "new event from a probationary source",
    "ref": "evt_08cbdd98e541"
  },
  {
    "created": "2026-10-21T15:47:36Z",
    "decided_in_pr": 43,
    "decision": "rejected",
    "id": "rev_8b8ca7ab8bb1",
    "kind": "event",
    "reason": "new event from a probationary source",
    "ref": "evt_e2bca0735977"
  },
  {
    "created": "2026-10-21T15:47:36Z",
    "decided_in_pr": 43,
    "decision": "rejected",
    "id": "rev_c082406aa396",
    "kind": "event",
    "reason": "new event from a probationary source",
    "ref": "evt_368de0296a29"
  },
  {
    "created": "2026-10-21T15:47:36Z",
    "decided_in_pr": 43,
    "decision": "approved",
    "id": "rev_d9f8aae8a794",
    "kind": "event",
    "reason": "new event from a probationary source",
    "ref": "evt_02212ade905b"
  },
  {
    "created": "2026-10-21T15:47:36Z",
    "decided_in_pr": 43,
    "decision": "rejected",
    "id": "rev_fb447e028258",
    "kind": "event",
    "reason": "new event from a probationary source",
    "ref": "evt_6ff23c592d21"
  },
  {
    "created": "2026-10-22T15:45:41Z",
    "decided_in_pr": null,
    "decision": "pending",
    "id": "rev_26bec290c628",
    "kind": "event",
    "reason": "needs review: no tech keywords",
    "ref": "evt_ef5e77cd1abf"
  },
  {
    "created": "2026-10-22T15:45:41Z",
    "decided_in_pr": 52,
    "decision": "rejected",
    "id": "rev_378588ea07f3",
    "kind": "event",
    "reason": "needs review: no tech keywords",
    "ref": "evt_f05c6bd26558"
  },
  {
    "created": "2026-10-22T15:45:41Z",
    "decided_in_pr": 52,
    "decision": "rejected",
    "id": "rev_38ccabdf7005",
    "kind": "event",
    "reason": "needs review: no tech keywords",
    "ref": "evt_41c4ffa804aa"
  },
  {
    "created": "2026-10-22T15:45:41Z",
    "decided_in_pr": 52,
    "decision": "rejected",
    "id": "rev_51b50cb89d1c",
    "kind": "event",
    "reason": "new event from a probationary source",
    "ref": "evt_89bd2436fb8e"
  },
  {
    "created": "2026-10-22T15:45:41Z",
    "decided_in_pr": 52,
    "decision": "rejected",
    "id": "rev_5f6b6d4b0663",
    "kind": "event",
    "reason": "needs review: no tech keywords",
    "ref": "evt_0fe59e2290b5"
  },
  {
    "created": "2026-10-22T15:45:41Z",
    "decided_in_pr": 52,
    "decision": "rejected",
    "id": "rev_62344cc68a38",
    "kind": "event",
    "reason": "needs review: no tech keywords",
    "ref": "evt_c26911b4c082"
  },
  {
    "created": "2026-10-22T15:45:41Z",
    "decided_in_pr": 52,
    "decision": "rejected",
    "id": "rev_672fc2c41505",
    "kind": "event",
    "reason": "needs review: no tech keywords",
    "ref": "evt_a878772942d2"
  },
  {
    "created": "2026-10-22T15:45:41Z",
    "decided_in_pr": 52,
    "decision": "rejected",
    "id": "rev_76ac0c184eb7",
    "kind": "event",
    "reason": "needs review: no tech keywords",
    "ref": "evt_c956ee787027"
  },
  {
    "created": "2026-10-22T15:45:41Z",
    "decided_in_pr": 52,
    "decision": "rejected",
    "id": "rev_8c0c63f3cd01",
    "kind": "event",
    "reason": "needs review: no tech keywords",
    "ref": "evt_540a3d68f74d"
  },
  {
    "created": "2026-10-22T15:45:41Z",
    "decided_in_pr": 52,
    "decision": "rejected",
    "id": "rev_8c87711f6127",
    "kind": "event",
    "reason": "needs review: no tech keywords",
    "ref": "evt_3e7f4642fc22"
  },
  {
    "created": "2026-10-22T15:45:41Z",
    "decided_in_pr": 52,
    "decision": "rejected",
    "id": "rev_908d7d4a4f04",
    "kind": "event",
    "reason": "needs review: no tech keywords",
    "ref": "evt_224758ba3cfa"
  },
  {
    "created": "2026-10-22T15:45:41Z",
    "decided_in_pr": null,
    "decision": "pending",
    "id": "rev_b392742f212b",
    "kind": "event",
    "reason": "new event from a probationary source",
    "ref": "evt_09f665033646"
  },
  {
    "created": "2026-10-22T15:45:41Z",
    "decided_in_pr": 52,
    "decision": "rejected",
    "id": "rev_b4296957cb09",
    "kind": "event",
    "reason": "needs review: no tech keywords",
    "ref": "evt_986ed2cee556"
  },
  {
    "created": "2026-10-22T15:45:41Z",
    "decided_in_pr": 52,
    "decision": "rejected",
    "id": "rev_cfe55ab669a7",
    "kind": "event",
    "reason": "needs review: no tech keywords",
    "ref": "evt_9b6eb23fb28f"
  },
  {
    "created": "2026-10-22T15:45:41Z",
    "decided_in_pr": 52,
    "decision": "rejected",
    "id": "rev_dae1510da1e5",
    "kind": "event",
    "reason": "needs review: no tech keywords",
    "ref": "evt_798c26645827"
  },
  {
    "created": "2026-10-22T15:45:41Z",
    "decided_in_pr": 52,
    "decision": "approved",
    "id": "rev_dc0c57094c85",
    "kind": "event",
    "reason": "new event from a probationary source",
    "ref": "evt_952f27c093f4"
  },
  {
    "created": "2026-10-23T17:40:38Z",
    "decided_in_pr": 79,
    "decision": "approved",
    "id": "rev_0f5da2bd4849",
    "kind": "event",
    "reason": "new event from a probationary source",
    "ref": "evt_ece5a7286e8e"
  },
  {
    "created": "2026-10-23T17:40:38Z",
    "decided_in_pr": 79,
    "decision": "approved",
    "id": "rev_1435e9d9c947",
    "kind": "event",
    "reason": "new event from a probationary source",
    "ref": "evt_5524c30a64ad"
  },
  {
    "created": "2026-10-23T17:40:38Z",
    "decided_in_pr": 79,
    "decision": "approved",
    "id": "rev_1aa4b4f97481",
    "kind": "event",
    "reason": "new event from a probationary source",
    "ref": "evt_d8df1563ce37"
  },
  {
    "created": "2026-10-23T17:40:38Z",
    "decided_in_pr": 79,
    "decision": "approved",
    "id": "rev_1cd690909185",
    "kind": "event",
    "reason": "new event from a probationary source",
    "ref": "evt_3f2daf6dd009"
  },
  {
    "created": "2026-10-23T17:40:38Z",
    "decided_in_pr": 79,
    "decision": "approved",
    "id": "rev_1eb28cff553e",
    "kind": "event",
    "reason": "new event from a probationary source",
    "ref": "evt_933ca1c0a5b2"
  },
  {
    "created": "2026-10-23T17:40:38Z",
    "decided_in_pr": 79,
    "decision": "rejected",
    "id": "rev_2f78d6463729",
    "kind": "event",
    "reason": "needs review: no tech keywords",
    "ref": "evt_c8cdafca33aa"
  },
  {
    "created": "2026-10-23T17:40:38Z",
    "decided_in_pr": 79,
    "decision": "rejected",
    "id": "rev_3542e33aab25",
    "kind": "event",
    "reason": "new event from a probationary source",
    "ref": "evt_03f6fb9d20ae"
  },
  {
    "created": "2026-10-23T17:40:38Z",
    "decided_in_pr": 79,
    "decision": "rejected",
    "id": "rev_361572280da2",
    "kind": "event",
    "reason": "needs review: no tech keywords",
    "ref": "evt_b513d821c1b7"
  },
  {
    "created": "2026-10-23T17:40:38Z",
    "decided_in_pr": 79,
    "decision": "rejected",
    "id": "rev_41d091481f9b",
    "kind": "event",
    "reason": "needs review: no tech keywords",
    "ref": "evt_3e753066b153"
  },
  {
    "created": "2026-10-23T17:40:38Z",
    "decided_in_pr": 79,
    "decision": "approved",
    "id": "rev_456b424a59f0",
    "kind": "event",
    "reason": "new event from a probationary source",
    "ref": "evt_d974e9ab2b81"
  },
  {
    "created": "2026-10-23T17:40:38Z",
    "decided_in_pr": 79,
    "decision": "rejected",
    "id": "rev_516fe9a8c369",
    "kind": "event",
    "reason": "needs review: no tech keywords",
    "ref": "evt_8fff5eb48051"
  },
  {
    "created": "2026-10-23T17:40:38Z",
    "decided_in_pr": 79,
    "decision": "rejected",
    "id": "rev_51fb4141a8cf",
    "kind": "event",
    "reason": "new event from a probationary source",
    "ref": "evt_558c8230b7b6"
  },
  {
    "created": "2026-10-23T17:40:38Z",
    "decided_in_pr": 79,
    "decision": "approved",
    "id": "rev_708661833ff8",
    "kind": "event",
    "reason": "new event from a probationary source",
    "ref": "evt_a32291f5f3e3"
  },
  {
    "created": "2026-10-23T17:40:38Z",
    "decided_in_pr": 79,
    "decision": "rejected",
    "id": "rev_70a5efbe138c",
    "kind": "event",
    "reason": "new event from a probationary source",
    "ref": "evt_bc32e9f3d8fc"
  },
  {
    "created": "2026-10-23T17:40:38Z",
    "decided_in_pr": 79,
    "decision": "rejected",
    "id": "rev_79b97e5f75b6",
    "kind": "event",
    "reason": "needs review: no tech keywords",
    "ref": "evt_c11f3a517293"
  },
  {
    "created": "2026-10-23T17:40:38Z",
    "decided_in_pr": 79,
    "decision": "approved",
    "id": "rev_847742b0fcaa",
    "kind": "event",
    "reason": "new event from a probationary source",
    "ref": "evt_95153047f870"
  },
  {
    "created": "2026-10-23T17:40:38Z",
    "decided_in_pr": 79,
    "decision": "approved",
    "id": "rev_9045c08e22ca",
    "kind": "event",
    "reason": "new event from a probationary source",